{
  "spead_flavour": {
    "version": 4,
    "item_pointer_bits": 64,
    "heap_address_bits": 40,
    "bug_compat_mask": 0
  },

  "observation":
  {
    "num_stations": 512,
    "num_channels": 4,
    "num_times": 9
  },

  "simulation": {
    "TBD": "xxx"
  },

  "sender_node": {
    "start_channel": 0,
    "streams": [
      {
        "port": 8001,
        "host": "127.0.0.1",
        "threads": 1,
        "rate": 0
      }
    ]
  }
}
